{
  "source_url": "https://gbatemp.net/threads/room-zoom-race-for-impact-hd-texture-pack.667832/",
  "listings": [
    "l-08443e3597"
  ],
  "fetched": {
    "at": "2026-10-03",
    "status": "ok",
    "title": "Room Zoom: Race For Impact HD Texture Pack"
  },
  "candidates": [
    {
      "url": "https://drive.google.com/file/d/1DJZw2qAtcfx1-MiOKhlcrCxec5BAXaoq/view",
      "host": "gdrive",
      "kind": "file",
      "where": "op",
      "context": "ed driving areas and hidden features, make each race an adventure. Spoiler: Download Link"
    }
  ],
  "decisions": [
    {
      "listing": "l-08443e3597",
      "status": "resolved",
      "base_url": "https://drive.google.com/file/d/1DJZw2qAtcfx1-MiOKhlcrCxec5BAXaoq/view",
      "host": "gdrive",
      "kind": "file",
      "confidence": "medium",
      "reason": "the only file-host link in op; not yet confirmed to be the pack itself",
      "decided_by": {
        "method": "deterministic",
        "date": "2026-10-03"
      }
    }
  ]
}
