{
  "source_url": "https://gbatemp.net/threads/gran-turismo-3-scus-97102-texture-pack-finished.633662/",
  "listings": [
    "l-0d81c356de"
  ],
  "fetched": {
    "at": "2026-10-03",
    "status": "ok",
    "title": "Gran Turismo 3 (SCUS-97102) - Texture Pack [Finished]"
  },
  "videos": [
    {
      "id": "Rx9BrKLB3rY",
      "uploader": "Gtafan",
      "links": [
        {
          "url": "https://www.gtplanet.net/forum/threads/gran-turismo-3-retexture-mod-v1-0-by-gtafan.410897/",
          "host": "other",
          "kind": "unknown",
          "where": "video_description",
          "context": "ase of the retexture mod to Gran Turismo 3 so here it is. I hope you enjoy the mod.  Download Link: ",
          "by_uploader": true
        }
      ]
    }
  ],
  "candidates": [
    {
      "url": "https://drive.google.com/file/d/1BRDFHPcm3au9izXNdLXCYXM0AaJI-aAg/view",
      "host": "gdrive",
      "kind": "file",
      "where": "op",
      "context": "*** UI and HUD upscailing isn't possible due to duplicates generated by PCSX2 and PS2 nature. *** Enjoy! Download Textures Here Alternative Download Link"
    },
    {
      "url": "https://mega.nz/file/3OwEwZjK#etPZ6gt1hLS54ZI4S66V7roN2ml-WeYMC74rMprMSg8",
      "host": "mega",
      "kind": "file",
      "where": "op",
      "context": "ing isn't possible due to duplicates generated by PCSX2 and PS2 nature. *** Enjoy! Download Textures Here Alternative Download Link Gran Turismo 3 Retextur"
    },
    {
      "url": "https://www.gtplanet.net/forum/threads/gran-turismo-3-retexture-mod-v1-0-by-gtafan.410897/",
      "host": "other",
      "kind": "unknown",
      "where": "op",
      "context": "joy! Download Textures Here Alternative Download Link Gran Turismo 3 Retexture Showcase (Author's video) GT Planet PASSWORD: cNEfz4vC37lNjCXLel72 All c"
    }
  ],
  "decisions": [
    {
      "listing": "l-0d81c356de",
      "status": "resolved",
      "base_url": "https://www.gtplanet.net/forum/threads/gran-turismo-3-retexture-mod-v1-0-by-gtafan.410897/",
      "host": "other",
      "kind": "page",
      "confidence": "high",
      "reason": "Creator's video description lists GTplanet forum thread as the download source.",
      "decided_by": {
        "method": "agent",
        "model": "haiku",
        "date": "2026-10-03"
      }
    }
  ]
}
