{
  "source_url": "https://gbatemp.net/threads/bully-canis-canem-edit-usa-ntsc-u-hd-remaster-texture-pack-2-2.645066/",
  "listings": [
    "l-0a9b53b4b4"
  ],
  "fetched": {
    "at": "2026-10-03",
    "status": "ok",
    "title": "Bully Canis Canem Edit (USA - NTSC-U) | HD Remaster Texture Pack 2.2"
  },
  "candidates": [
    {
      "url": "https://ouo.io/n9haUWx",
      "host": "other",
      "kind": "unknown",
      "where": "op",
      "context": "File Size: 3.20 GB 7.5k textures Youtube Video: Install Tutorial: Download HD Pack 2.2 Use free download manager fo"
    },
    {
      "url": "https://ko-fi.com/moatazmoadi",
      "host": "kofi",
      "kind": "page",
      "where": "op",
      "context": "e drop fps make it on PCSX2 HD Texture Pack Discord Server: https://discord.gg/ZGm5uN5eGV ko-fi to support me https://ko-fi.com/moatazmoadi My youtube channel h"
    }
  ],
  "decisions": [
    {
      "listing": "l-0a9b53b4b4",
      "status": "gated",
      "confidence": "high",
      "reason": "Main download link uses ouo.io advert wall, blocks direct access.",
      "decided_by": {
        "method": "agent",
        "model": "haiku",
        "date": "2026-10-03"
      }
    }
  ]
}
