{
  "source_url": "https://gbatemp.net/threads/ford-vs-chevy-pcsx2-hd-texture.671196/",
  "listings": [
    "l-1b8e314bec"
  ],
  "fetched": {
    "at": "2026-10-03",
    "status": "ok",
    "title": "Ford vs. Chevy PCSX2 HD Texture"
  },
  "videos": [
    {
      "id": "m4OU02d5oHQ",
      "uploader": "Mvp899",
      "links": [
        {
          "url": "https://mpago.la/1vrS47b",
          "host": "other",
          "kind": "unknown",
          "where": "video_description",
          "context": "donate:",
          "by_uploader": true
        },
        {
          "url": "https://mega.nz/file/ZE4FCRJK#cP-PXCy-jlGFlz9ufTNa_dPtTtihk1Jwqo_vEO944kc",
          "host": "mega",
          "kind": "file",
          "where": "video_pinned_comment",
          "context": "PACK:",
          "by_uploader": true
        }
      ]
    }
  ],
  "candidates": [
    {
      "url": "https://ko-fi.com/mvp89974957",
      "host": "kofi",
      "kind": "page",
      "where": "op",
      "context": "KO-FI SERIAL: SLUS-21276 CRC: 54E7BAEE SIZE: 725mb"
    }
  ],
  "decisions": [
    {
      "listing": "l-1b8e314bec",
      "status": "resolved",
      "base_url": "https://mega.nz/file/ZE4FCRJK#cP-PXCy-jlGFlz9ufTNa_dPtTtihk1Jwqo_vEO944kc",
      "host": "mega",
      "kind": "file",
      "confidence": "medium",
      "reason": "the only file-host link in video pinned comment; not yet confirmed to be the pack itself",
      "decided_by": {
        "method": "deterministic",
        "date": "2026-10-03"
      }
    }
  ]
}
