{
  "source_url": "https://gbatemp.net/threads/jak-and-daxter-the-lost-frontier-pcsx2-hd-texture.672415/",
  "listings": [
    "l-8f09426e58"
  ],
  "fetched": {
    "at": "2026-10-03",
    "status": "ok",
    "title": "Jak and Daxter The Lost Frontier PCSX2 HD Texture Upadate 2026"
  },
  "videos": [
    {
      "id": "gpFkoCha3h0",
      "uploader": "Mvp899",
      "links": [
        {
          "url": "https://ko-fi.com/s/749eeb48dc",
          "host": "kofi",
          "kind": "shop",
          "where": "video_pinned_comment",
          "context": "pack:",
          "by_uploader": true
        }
      ]
    }
  ],
  "candidates": [
    {
      "url": "https://ko-fi.com/mvp89974957",
      "host": "kofi",
      "kind": "page",
      "where": "op",
      "context": "KO-FI SERIAL: SCUS-97558 CRC: 09651B23 SIZE: 431mb"
    }
  ],
  "decisions": [
    {
      "listing": "l-8f09426e58",
      "status": "resolved",
      "base_url": "https://ko-fi.com/s/749eeb48dc",
      "host": "kofi",
      "kind": "shop",
      "confidence": "medium",
      "reason": "the only file-host link in video pinned comment; not yet confirmed to be the pack itself",
      "decided_by": {
        "method": "deterministic",
        "date": "2026-10-03"
      }
    }
  ]
}
