{
  "source_url": "https://gbatemp.net/threads/the-bouncer-hd-texture-pack.640144/",
  "listings": [
    "l-af87b6c507"
  ],
  "fetched": {
    "at": "2026-10-03",
    "status": "ok",
    "title": "The Bouncer HD Texture Pack"
  },
  "candidates": [
    {
      "url": "https://drive.google.com/file/d/1DXdJDZwRKXvitLPpbha-KGA22Bbgw3pF/view?usp=drive_link",
      "host": "gdrive",
      "kind": "file",
      "where": "op",
      "context": "rs for the USA version (SLUS-20069) of The Bouncer Spoiler: Images Download Link: Here Mirror: Here Extract the the files with 7-Zip"
    },
    {
      "url": "https://mega.nz/file/wwVglJQQ#CklvBzUaYNit8ezAMnJ548oo1xpFWoQkNM4B48kqTEc",
      "host": "mega",
      "kind": "file",
      "where": "op",
      "context": "A version (SLUS-20069) of The Bouncer Spoiler: Images Download Link: Here Mirror: Here Extract the the files with 7-Zip, Winrar or a"
    }
  ],
  "decisions": [
    {
      "listing": "l-af87b6c507",
      "status": "resolved",
      "base_url": "https://drive.google.com/file/d/1DXdJDZwRKXvitLPpbha-KGA22Bbgw3pF/view?usp=drive_link",
      "host": "gdrive",
      "kind": "file",
      "confidence": "high",
      "reason": "Creator marked as Download Link in opening post; Google Drive is primary.",
      "decided_by": {
        "method": "agent",
        "model": "haiku",
        "date": "2026-10-03"
      }
    }
  ]
}
