{
  "source_url": "https://gbatemp.net/threads/dynasty-warriors-3-3xl-expansive-hd-texture-mod-2-4k.666849/",
  "listings": [
    "l-64d892a44d"
  ],
  "fetched": {
    "at": "2026-10-03",
    "status": "ok",
    "title": "DYNASTY WARRIORS 3 / 3XL EXPANSIVE HD TEXTURE MOD (2-4k) UPDATED"
  },
  "candidates": [
    {
      "url": "https://ko-fi.com/aurvi_warriors/shop",
      "host": "kofi",
      "kind": "page",
      "where": "op",
      "context": "ns I helped with. The original swaps, as well as instructions on installing and screenshots can be found here https://ko-fi.com/aurvi_warriors/shop. Please supp"
    },
    {
      "url": "https://ko-fi.com/gvngnir",
      "host": "kofi",
      "kind": "page",
      "where": "op",
      "context": "f you have a kind heart and want to see more work done on these games, send some love and consider donating a coffee to the cause. I know, why donate when you"
    },
    {
      "url": "https://drive.google.com/file/d/1aixV-UMX7HpyGjrEZLTzQM2zGUWNNZsU/view",
      "host": "gdrive",
      "kind": "file",
      "where": "op",
      "context": "e there already. Follow performance recommendations from the community and tweak to taste. Simple DOWNLOAD: DONATE : https://ko-fi.com/GVNGNIR (support a s"
    },
    {
      "url": "https://ko-fi.com/GVNGNIR",
      "host": "kofi",
      "kind": "page",
      "where": "op",
      "context": "ady. Follow performance recommendations from the community and tweak to taste. Simple DOWNLOAD: DONATE : https://ko-fi.com/GVNGNIR (support a starving arti"
    }
  ],
  "decisions": [
    {
      "listing": "l-64d892a44d",
      "status": "resolved",
      "base_url": "https://drive.google.com/file/d/1aixV-UMX7HpyGjrEZLTzQM2zGUWNNZsU/view",
      "host": "gdrive",
      "kind": "file",
      "confidence": "medium",
      "reason": "the only file-host link in op; not yet confirmed to be the pack itself",
      "decided_by": {
        "method": "deterministic",
        "date": "2026-10-03"
      }
    }
  ]
}
