{
  "source_url": "https://gbatemp.net/threads/bujingai-the-forsaken-city-texture-pack.640702/",
  "listings": [
    "l-db54bd50f7"
  ],
  "fetched": {
    "at": "2026-10-03",
    "status": "ok",
    "title": "Bujingai: The Forsaken City Texture pack"
  },
  "candidates": [
    {
      "url": "https://archive.org/details/replacements.7z_202310",
      "host": "archive_org",
      "kind": "file",
      "where": "op",
      "context": "bination of ESRGAN, RealSR and Waifu2x all at 4X depending on what looked best. Files here! https://archive.org/details/replacements.7z_202310"
    }
  ],
  "decisions": [
    {
      "listing": "l-db54bd50f7",
      "status": "resolved",
      "base_url": "https://archive.org/details/replacements.7z_202310",
      "host": "archive_org",
      "kind": "file",
      "confidence": "medium",
      "reason": "the only file-host link in op; not yet confirmed to be the pack itself",
      "decided_by": {
        "method": "deterministic",
        "date": "2026-10-03"
      }
    }
  ]
}
