{
  "source_url": "https://gbatemp.net/threads/cho-aniki-seinaru-protein-densetsu-hd-pack-pcsx2.681359/",
  "listings": [
    "l-5903d6d93a"
  ],
  "fetched": {
    "at": "2026-10-03",
    "status": "ok",
    "title": "Cho Aniki - Seinaru Protein Densetsu HD Pack PCSX2"
  },
  "videos": [
    {
      "id": "l7w_j4OK8Eg",
      "uploader": "ironhulk33",
      "links": [
        {
          "url": "https://www.patreon.com/c/ironhulk33",
          "host": "patreon",
          "kind": "page",
          "where": "video_description",
          "context": "ating to the Patreon for full access to my packs for free and notifications when more are dropped!  ",
          "by_uploader": true
        },
        {
          "url": "https://www.mediafire.com/folder/k8yncbpnlckw3/ironhulk33#2ie0qajlodjxz",
          "host": "mediafire",
          "kind": "folder",
          "where": "video_description",
          "context": "e. Its certainly something. Enjoy, I did this on a whim. Its a Shmup.  Where to Find the Downloads: ",
          "by_uploader": true
        },
        {
          "url": "https://1024terabox.com/s/1cq1iVjzKIvd1LZwfKnai2Q",
          "host": "terabox",
          "kind": "file",
          "where": "video_description",
          "context": "here to Find the Downloads: https://www.mediafire.com/folder/k8yncbpnlckw3/ironhulk33#2ie0qajlodjxz ",
          "by_uploader": true
        }
      ]
    }
  ],
  "candidates": [
    {
      "url": "https://www.patreon.com/c/ironhulk33",
      "host": "patreon",
      "kind": "page",
      "where": "op",
      "context": "onsider Donating to the Patreon for full access to my packs for free and notifications when more are dropped! https://www.patreon.com/c/ironhulk33 This games f"
    },
    {
      "url": "https://www.mediafire.com/folder/k8yncbpnlckw3/ironhulk33#2ie0qajlodjxz",
      "host": "mediafire",
      "kind": "folder",
      "where": "op",
      "context": "aky. Like me. Its certainly something. Enjoy, I did this on a whim. Its a Shmup. Where to Find the Downloads:https://www.mediafire.com/folder/k8yncbpnlckw3/iro"
    },
    {
      "url": "https://1024terabox.com/s/1cq1iVjzKIvd1LZwfKnai2Q",
      "host": "terabox",
      "kind": "file",
      "where": "op",
      "context": "a Shmup. Where to Find the Downloads:https://www.mediafire.com/folder/k8yncbpnlckw3/ironhulk33#2ie0qajlodjxz https://1024terabox.com/s/1cq1iVjzKIvd1LZwfKnai2Q"
    }
  ],
  "decisions": [
    {
      "listing": "l-5903d6d93a",
      "status": "resolved",
      "base_url": "https://www.mediafire.com/folder/k8yncbpnlckw3/ironhulk33#2ie0qajlodjxz",
      "host": "mediafire",
      "kind": "folder",
      "confidence": "high",
      "reason": "Creator explicitly listed under 'Where to Find the Downloads' in opening post.",
      "decided_by": {
        "method": "agent",
        "model": "haiku",
        "date": "2026-10-03"
      }
    }
  ]
}
