{
  "source_url": "https://gbatemp.net/threads/naruto-shippuden-ultimate-ninja-5-eur-sles-55605-upscaled-texture-pack.664569/",
  "listings": [
    "l-851b77fd8c"
  ],
  "fetched": {
    "at": "2026-10-03",
    "status": "ok",
    "title": "Naruto Shippuden: Ultimate Ninja 5 (EUR) (SLES-55605) AI Upscaled Texture Pack"
  },
  "videos": [
    {
      "id": "cJjpB-bXbWA",
      "uploader": "Sal9im",
      "links": [
        {
          "url": "https://ko-fi.com/sal9im",
          "host": "kofi",
          "kind": "page",
          "where": "video_description",
          "context": "Naruto Shippuden Ultimate Ninja 5 PCSX2 ( AI Upscaled ) Texture Pack  Support me if like My work ",
          "by_uploader": true
        }
      ]
    }
  ],
  "candidates": [
    {
      "url": "https://drive.google.com/file/d/1N_M75nQdi5uX41iWmcPD7nxs_fbfIXF8/view?usp=sharing",
      "host": "gdrive",
      "kind": "file",
      "where": "op",
      "context": "LES-55605 Upscale Model Used: 4xHDcube4 & Real Esrgan Plus (Anime) PCSX2 VERSION: 2.1.121 Texture Format: DDS DOWNLOAD TEXTUR PACK >>> (Size 2.51gb) >>> 19.7gb"
    },
    {
      "url": "https://ko-fi.com/sal9im",
      "host": "kofi",
      "kind": "page",
      "where": "op",
      "context": "r = (Xbox/Buttons OR PS5/Buttons) to replacements and replace the existing. Support me if you like my work https://ko-fi.com/sal9im Spoiler: Compa"
    },
    {
      "url": "https://narutimatemodding.blogspot.com/2023/09/english-ultimate-ninja-6-alpha-20.html",
      "host": "other",
      "kind": "unknown",
      "where": "reply_by_other",
      "context": "awesome! could you consider doing a pack for the ultimate ninja 6 mod? here it is: https://narutimatemodding.blogspot.com/2023/09/eng"
    }
  ],
  "decisions": [
    {
      "listing": "l-851b77fd8c",
      "status": "resolved",
      "base_url": "https://drive.google.com/file/d/1N_M75nQdi5uX41iWmcPD7nxs_fbfIXF8/view?usp=sharing",
      "host": "gdrive",
      "kind": "file",
      "confidence": "medium",
      "reason": "the only file-host link in op; not yet confirmed to be the pack itself",
      "decided_by": {
        "method": "deterministic",
        "date": "2026-10-03"
      }
    }
  ]
}
