{
  "source_url": "https://gbatemp.net/threads/kaan-barbarian-blade-hd-texture-demo.658505/",
  "listings": [
    "l-c40ff23a0d"
  ],
  "fetched": {
    "at": "2026-10-03",
    "status": "ok",
    "title": "Kaan Barbarian Blade HD Texture demo"
  },
  "candidates": [
    {
      "url": "https://mega.nz/file/OKwDXDKb#9WpVlrE5OZjbYSPVFQ0yCBjUdp5X9xGw3awPKacHbKM",
      "host": "mega",
      "kind": "file",
      "where": "op",
      "context": "Link: Mega Full version not done yet You can"
    }
  ],
  "decisions": [
    {
      "listing": "l-c40ff23a0d",
      "status": "resolved",
      "base_url": "https://mega.nz/file/OKwDXDKb#9WpVlrE5OZjbYSPVFQ0yCBjUdp5X9xGw3awPKacHbKM",
      "host": "mega",
      "kind": "file",
      "confidence": "medium",
      "reason": "the only file-host link in op; not yet confirmed to be the pack itself",
      "decided_by": {
        "method": "deterministic",
        "date": "2026-10-03"
      }
    }
  ]
}
