{
  "source_url": "https://gbatemp.net/threads/codebreaker-v10-hd-texture.649614/",
  "listings": [
    "l-73d6062958"
  ],
  "fetched": {
    "at": "2026-10-03",
    "status": "ok",
    "title": "CodeBreaker v10 HD TEXTURE"
  },
  "candidates": [
    {
      "url": "https://www.mediafire.com/file/sp1hh7tsoxhluac/CodeBreaker_v10.rar/file",
      "host": "mediafire",
      "kind": "file",
      "where": "op",
      "context": "DOWNLAOD PAYPAL"
    }
  ],
  "decisions": [
    {
      "listing": "l-73d6062958",
      "status": "resolved",
      "base_url": "https://www.mediafire.com/file/sp1hh7tsoxhluac/CodeBreaker_v10.rar/file",
      "host": "mediafire",
      "kind": "file",
      "confidence": "medium",
      "reason": "the only file-host link in op; not yet confirmed to be the pack itself",
      "decided_by": {
        "method": "deterministic",
        "date": "2026-10-03"
      }
    }
  ]
}
