{
  "source_url": "https://gbatemp.net/threads/uchuu-keiji-tamashii-the-space-sheriff-spirits-hd-remastered.678197/",
  "listings": [
    "l-7980a2cc33"
  ],
  "fetched": {
    "at": "2026-10-03",
    "status": "ok",
    "title": "Uchuu Keiji Tamashii: The Space Sheriff Spirits HD Remastered"
  },
  "videos": [
    {
      "id": "5IHUm7SE17E",
      "uploader": "Hitori",
      "links": []
    }
  ],
  "candidates": [
    {
      "url": "https://wiki.pcsx2.net/Uchuu_Keiji_Tamashii:_The_Space_Sheriff_Spirits",
      "host": "other",
      "kind": "unknown",
      "where": "op",
      "context": "Uchuu Keiji Tamashii: The Space Sheriff Spirits HD Remastered Version: 1.0 PCSX2 wiki: https://wiki.pcsx2.net/Uchuu_Keiji_Tamashii:_The_S"
    },
    {
      "url": "https://drive.google.com/file/d/1staLx6yPVvJuZbjp70lRqq8hJHW_y8TO/view?usp=sharing",
      "host": "gdrive",
      "kind": "file",
      "where": "op",
      "context": "gh resolution) Download (password to extract: hitori_hoshi): Spoiler: PCSX2 GDrive: SpaceSheriffSpirit_HD Mediafire: https://www.media"
    },
    {
      "url": "https://www.mediafire.com/file/a1lzmm4uo2lh26v/PCSX2_GavanHD.rar/file",
      "host": "mediafire",
      "kind": "file",
      "where": "op",
      "context": "assword to extract: hitori_hoshi): Spoiler: PCSX2 GDrive: SpaceSheriffSpirit_HD Mediafire: https://www.mediafire.com/file/a1lzmm4uo2lh26v/PCS"
    },
    {
      "url": "https://drive.google.com/file/d/1hRHuUExmRqPLH8T_4liRsLZQQPea6bK3/view?usp=sharing",
      "host": "gdrive",
      "kind": "file",
      "where": "op",
      "context": "com/file/a1lzmm4uo2lh26v/PCSX2_GavanHD.rar/file Spoiler: AetherSX2/NetherSX2 GDrive: SpaceSheirffSpirit_HD_AetherSX2 Mediafire: https:/"
    },
    {
      "url": "https://www.mediafire.com/file/m77m2aiaipouo9r/AetherSX2_GavanHD.rar/file",
      "host": "mediafire",
      "kind": "file",
      "where": "op",
      "context": "file Spoiler: AetherSX2/NetherSX2 GDrive: SpaceSheirffSpirit_HD_AetherSX2 Mediafire: https://www.mediafire.com/file/m77m2aiaipouo9r/Aet"
    }
  ],
  "decisions": [
    {
      "listing": "l-7980a2cc33",
      "status": "resolved",
      "base_url": "https://drive.google.com/file/d/1staLx6yPVvJuZbjp70lRqq8hJHW_y8TO/view?usp=sharing",
      "host": "gdrive",
      "kind": "file",
      "confidence": "high",
      "reason": "Creator provided Google Drive link for PCSX2 version in opening post.",
      "decided_by": {
        "method": "agent",
        "model": "haiku",
        "date": "2026-10-03"
      }
    }
  ]
}
