{
  "source_url": "https://gbatemp.net/threads/naruto-shippuden-ultimate-ninja-4-slus-21862-upscaled-texture-pack.663636/",
  "listings": [
    "l-510f934da8"
  ],
  "fetched": {
    "at": "2026-10-03",
    "status": "ok",
    "title": "Naruto Shippuden Ultimate Ninja 4 (SLUS - 21862) AI Upscaled Texture Pack"
  },
  "videos": [
    {
      "id": "Ihor2J-yZv4",
      "uploader": "Sal9im",
      "links": [
        {
          "url": "https://ko-fi.com/sal9im",
          "host": "kofi",
          "kind": "page",
          "where": "video_description",
          "context": "Naruto Shippuden Ultimate Ninja 4 PCSX2 ( AI Upscaled ) Texture Pack  Support me if like My work ",
          "by_uploader": true
        }
      ]
    }
  ],
  "candidates": [
    {
      "url": "https://drive.google.com/file/d/1x4WRyr2jtcqnzKYIAuTub6MEES_DQf6w/view?usp=sharing",
      "host": "gdrive",
      "kind": "file",
      "where": "op",
      "context": "US-21862 Upscale Model Used: 4xHDcube4 & Real Esrgan Plus (Anime) PCSX2 VERSION: 2.1.121 Texture Format: DDS DOWNLOAD TEXTUR PACK >>> (Size 1.81gb) >>> 9.70gb"
    },
    {
      "url": "https://ko-fi.com/sal9im",
      "host": "kofi",
      "kind": "page",
      "where": "op",
      "context": "r = (Xbox/Buttons OR PS5/Buttons) to replacements and replace the existing. Support me if you like my work https://ko-fi.com/sal9im Spoiler: Scree"
    }
  ],
  "decisions": [
    {
      "listing": "l-510f934da8",
      "status": "resolved",
      "base_url": "https://drive.google.com/file/d/1x4WRyr2jtcqnzKYIAuTub6MEES_DQf6w/view?usp=sharing",
      "host": "gdrive",
      "kind": "file",
      "confidence": "medium",
      "reason": "the only file-host link in op; not yet confirmed to be the pack itself",
      "decided_by": {
        "method": "deterministic",
        "date": "2026-10-03"
      }
    }
  ]
}
