{
  "source_url": "https://gbatemp.net/threads/kill-switch-pcsx2-hd-texture.683102/",
  "listings": [
    "l-e30d0bd004"
  ],
  "fetched": {
    "at": "2026-10-03",
    "status": "ok",
    "title": "kill.switch PCSX2 HD Texture"
  },
  "videos": [
    {
      "id": "ZQII56SYQ4w",
      "uploader": "Mvp899",
      "links": [
        {
          "url": "https://ko-fi.com/s/94fe005066",
          "host": "kofi",
          "kind": "shop",
          "where": "video_pinned_comment",
          "context": "PACK:",
          "by_uploader": true
        }
      ]
    }
  ],
  "candidates": [],
  "decisions": [
    {
      "listing": "l-e30d0bd004",
      "status": "resolved",
      "base_url": "https://ko-fi.com/s/94fe005066",
      "host": "kofi",
      "kind": "shop",
      "confidence": "medium",
      "reason": "the only file-host link in video pinned comment; not yet confirmed to be the pack itself",
      "decided_by": {
        "method": "deterministic",
        "date": "2026-10-03"
      }
    }
  ]
}
