{
  "source_url": "https://gbatemp.net/threads/dragon-ball-z-budokai-tenkaichi-3-uhd-remaster-not-complete-v1.645442/",
  "listings": [
    "l-050eeff902"
  ],
  "fetched": {
    "at": "2026-10-03",
    "status": "ok",
    "title": "Dragon Ball Z Budokai Tenkaichi 3 UHD Remaster (Not Complete) v1"
  },
  "candidates": [
    {
      "url": "https://pcsx2.net/downloads/",
      "host": "other",
      "kind": "unknown",
      "where": "op",
      "context": "Texture Pack create by me for PCSX2 Emulator. - I recommend the latest version of the emulator. https://pcsx2.net/downloads TEXTURES % : I only"
    },
    {
      "url": "https://drive.google.com/file/d/1EdE-Epfh5s8BkcjIZ3IrHN8cf3Hlrkaq/view",
      "host": "gdrive",
      "kind": "file",
      "where": "op",
      "context": "AFTER DOWNLOAD REMASTERED VERSION V1:"
    }
  ],
  "decisions": [
    {
      "listing": "l-050eeff902",
      "status": "resolved",
      "base_url": "https://drive.google.com/file/d/1EdE-Epfh5s8BkcjIZ3IrHN8cf3Hlrkaq/view",
      "host": "gdrive",
      "kind": "file",
      "confidence": "medium",
      "reason": "the only file-host link in op; not yet confirmed to be the pack itself",
      "decided_by": {
        "method": "deterministic",
        "date": "2026-10-03"
      }
    }
  ]
}
