{
  "source_url": "https://gbatemp.net/threads/sombershrouds-hd-textures-megamix.637948/",
  "listings": [
    "l-f9158e4692"
  ],
  "fetched": {
    "at": "2026-10-03",
    "status": "ok",
    "title": "SomberShrouds HD Textures Megamix"
  },
  "candidates": [
    {
      "url": "https://www.mediafire.com/folder/p014592m0lmc6/Emulations",
      "host": "mediafire",
      "kind": "folder",
      "where": "op",
      "context": "A list of all my HD Texture Packs: https://www.mediafire.com/folder/p014592m0lmc6/Emu"
    },
    {
      "url": "https://www.mediafire.com/file/cdcr1cvcr0zx3eb/20020207-164243.zip/file",
      "host": "mediafire",
      "kind": "file",
      "where": "op",
      "context": "s (PS2 USA) HD Textures Thread: https://gbatemp.net/threads/ps2-bios-usa-hd-textures.650891/ https://www.mediafire.com/file/cdcr1cvcr0zx3eb/200"
    },
    {
      "url": "https://www.mediafire.com/file/5n71mpci5q3lyf9/SLUS-21316.zip/file",
      "host": "mediafire",
      "kind": "file",
      "where": "op",
      "context": "d: https://gbatemp.net/threads/capcom-classics-collection-vol-1-2-usa-hd-textures-menu-only.645343/ 1st https://www.mediafire.com/file/5n71mpci5q3lyf9/SLU"
    },
    {
      "url": "https://www.mediafire.com/file/wjxkl0o2ibqgpqp/SLUS-21260.zip/file",
      "host": "mediafire",
      "kind": "file",
      "where": "op",
      "context": "Thread: https://gbatemp.net/threads/ed-edd-n-eddy-the-mis-edventures-usa-hd-textures.643611/ https://www.mediafire.com/file/wjxkl0o2ibqgpqp/SLU"
    },
    {
      "url": "https://www.mediafire.com/file_premium/4u6blz921h6slsn/SLUS-21224.zip/file",
      "host": "mediafire",
      "kind": "file",
      "where": "op",
      "context": "ro (USA) HD Textures Thread: https://gbatemp.net/threads/guitar-hero-usa-hd-textures.671234/ https://www.mediafire.com/file_premium/4u6blz921h6"
    },
    {
      "url": "https://www.mediafire.com/file_premium/ptxduse8eo93hzp/SLUS-21672.zip/file",
      "host": "mediafire",
      "kind": "file",
      "where": "op",
      "context": "Thread: https://gbatemp.net/threads/guitar-hero-iii-legends-of-rock-usa-hd-textures.671388/ https://www.mediafire.com/file_premium/ptxduse8eo9"
    },
    {
      "url": "https://www.mediafire.com/file/k58xy5yqtivw5k4/SLUS-20579.zip/file",
      "host": "mediafire",
      "kind": "file",
      "where": "op",
      "context": "extures Thread: https://gbatemp.net/threads/james-bond-007-nightfire-usa-hd-textures.637947/ https://www.mediafire.com/file/k58xy5yqtivw5k4/SLU"
    },
    {
      "url": "https://www.mediafire.com/file/kqr6nse1bwbrlza/SLUS-20753.zip/file",
      "host": "mediafire",
      "kind": "file",
      "where": "op",
      "context": "Thread: https://gbatemp.net/threads/medal-of-honor-rising-sun-usa-hd-textures-multiplayer-only.639594/ https://www.mediafire.com/file/kqr6nse1bwbrlza/SLU"
    },
    {
      "url": "https://www.mediafire.com/file/pzso8fxsamny7ov/SLUS-21550.zip/file",
      "host": "mediafire",
      "kind": "file",
      "where": "op",
      "context": ") Thread: https://gbatemp.net/threads/metal-slug-anthology-usa-hd-textures-menu-only.639873/ https://www.mediafire.com/file/pzso8fxsamny7ov/SLU"
    },
    {
      "url": "https://mega.nz/file/56lQzKZB#v20PKMH6r6ll56sArUzKzOMUI_5zU34ANCZZvy-uQpc",
      "host": "mega",
      "kind": "file",
      "where": "op",
      "context": "Thread: https://gbatemp.net/threads/need-for-speed-most-wanted-black-edition-usa-hd-textures.650550/ https://mega.nz/file/56lQzKZB#v20PKMH6r6ll56sArUzK"
    },
    {
      "url": "https://www.mediafire.com/file/l1w4t1842l9cn7f/SLUS-21009.zip/file",
      "host": "mediafire",
      "kind": "file",
      "where": "op",
      "context": "Thread: https://gbatemp.net/threads/sega-classics-collection-usa-hd-textures-menu-only.651372/ https://www.mediafire.com/file/l1w4t1842l9cn7f/SLU"
    },
    {
      "url": "https://www.mediafire.com/file/obts7lo5lublmim/SLUS-20907.zip/file",
      "host": "mediafire",
      "kind": "file",
      "where": "op",
      "context": "tures Thread: https://gbatemp.net/threads/serious-sam-next-encounter-usa-hd-textures.638281/ https://www.mediafire.com/file/obts7lo5lublmim/SLU"
    },
    {
      "url": "https://www.mediafire.com/file/x5xpa1r5kvy7uq3/SLUS-20326.zip/file",
      "host": "mediafire",
      "kind": "file",
      "where": "op",
      "context": "icky (USA) HD Textures Thread: https://gbatemp.net/threads/ssx-tricky-usa-hd-textures.651251/ https://www.mediafire.com/file/x5xpa1r5kvy7uq3/SLU"
    },
    {
      "url": "https://www.mediafire.com/file/5s9772rl6t6h0u3/SLUS-20420.zip/file",
      "host": "mediafire",
      "kind": "file",
      "where": "op",
      "context": "Textures Thread: https://gbatemp.net/threads/star-wars-bounty-hunter-usa-hd-textures.639856/ https://www.mediafire.com/file/5s9772rl6t6h0u3/SLU"
    },
    {
      "url": "https://www.mediafire.com/file/c8t4qp0builzlqj/SLUS-21122.zip/file",
      "host": "mediafire",
      "kind": "file",
      "where": "op",
      "context": "Thread: https://gbatemp.net/threads/taito-legends-1-2-usa-hd-textures-menu-only.639603/ 1st https://www.mediafire.com/file/c8t4qp0builzlqj/SLU"
    },
    {
      "url": "https://www.mediafire.com/file/srrad3zmzouzq1m/SLUS-21349.zip/file",
      "host": "mediafire",
      "kind": "file",
      "where": "op",
      "context": "-textures-menu-only.639603/ 1st https://www.mediafire.com/file/c8t4qp0builzlqj/SLUS-21122.zip/file 2nd https://www.mediafire.com/file/srrad3zmzouzq1m/SLU"
    },
    {
      "url": "https://www.mediafire.com/file/qyjdje07ymjdu76/SLUS-20328.zip/file",
      "host": "mediafire",
      "kind": "file",
      "where": "op",
      "context": "ken 4 (USA) HD Textures Thread: https://gbatemp.net/threads/tekken-4-usa-hd-textures.652872/ https://www.mediafire.com/file/qyjdje07ymjdu76/SLU"
    },
    {
      "url": "https://www.mediafire.com/file/q5aapbctqsq6159/SLUS-20170.zip/file",
      "host": "mediafire",
      "kind": "file",
      "where": "op",
      "context": "s Thread: https://gbatemp.net/threads/the-adventures-of-cookie-cream-usa-hd-textures.637809/ https://www.mediafire.com/file/q5aapbctqsq6159/SLU"
    },
    {
      "url": "https://www.onihdrp.com/",
      "host": "other",
      "kind": "unknown",
      "where": "op_followup",
      "context": "and improved some textures. I stopped work on Onimusha 2 and 3 because there is already an HD Remaster for it https://www.onihdrp.com/. I was also planning on d"
    }
  ],
  "decisions": [
    {
      "listing": "l-f9158e4692",
      "status": "resolved",
      "base_url": "https://www.mediafire.com/file_premium/4u6blz921h6slsn/SLUS-21224.zip/file",
      "host": "mediafire",
      "kind": "file",
      "confidence": "high",
      "reason": "Creator listed specific Guitar Hero file (SLUS-21224) in opening post megamix.",
      "decided_by": {
        "method": "agent",
        "model": "haiku",
        "date": "2026-10-03"
      }
    }
  ]
}
