{
  "source_url": "https://gbatemp.net/threads/flatout-2-slus-21251-4k-remastered.667610/",
  "listings": [
    "l-3471a4bd0f"
  ],
  "fetched": {
    "at": "2026-10-03",
    "status": "ok",
    "title": "FlatOut 2 [SLUS-21251] 4K Remastered"
  },
  "candidates": [
    {
      "url": "https://cloud.mail.ru/public/ejcK/Bo4q4Jbh5",
      "host": "other",
      "kind": "unknown",
      "where": "op",
      "context": "FlatOut 2 in awesome quality! Just in time for the release of achievements on RetroAchievements Download: part1 part2 Spoiler: Comparison"
    },
    {
      "url": "https://cloud.mail.ru/public/JwNo/9GSBZsCwd",
      "host": "other",
      "kind": "unknown",
      "where": "op",
      "context": "t 2 in awesome quality! Just in time for the release of achievements on RetroAchievements Download: part1 part2 Spoiler: Comparison"
    }
  ],
  "decisions": [
    {
      "listing": "l-3471a4bd0f",
      "status": "ambiguous",
      "base_url": "https://cloud.mail.ru/public/ejcK/Bo4q4Jbh5",
      "host": "other",
      "kind": "unknown",
      "confidence": "low",
      "reason": "Two cloud.mail.ru links labeled 'part1 part2' without clarity on pack composition.",
      "decided_by": {
        "method": "agent",
        "model": "haiku",
        "date": "2026-10-03"
      }
    }
  ]
}
