{
  "source_url": "https://gbatemp.net/threads/dragonmortal-kombat-shaolin-monks-hd-texture-by-matasiete-dragon.673436/",
  "listings": [
    "l-6a96f8be47"
  ],
  "fetched": {
    "at": "2026-10-03",
    "status": "ok",
    "title": "🐉Mortal Kombat Shaolin Monks (HD Texture by Matasiete)🐉"
  },
  "videos": [
    {
      "id": "Hz-kde1hcwk",
      "uploader": "Luk89",
      "links": [
        {
          "url": "https://www.youtube.com/watch?v=_6ET4NV6jAI",
          "host": "youtube",
          "kind": "unknown",
          "where": "video_description",
          "context": "shaolin-monks-hd-texture-by-matasiete-dragon.673436  COMO DESBLOQUEAR TODOS LOS PERSONAJES EN UMKSM ",
          "by_uploader": true
        },
        {
          "url": "https://pcsx2.net",
          "host": "other",
          "kind": "unknown",
          "where": "video_description",
          "context": " COMO DESBLOQUEAR TODOS LOS PERSONAJES EN UMKSM https://www.youtube.com/watch?v=_6ET4NV6jAI  PCSX2: ",
          "by_uploader": true
        },
        {
          "url": "https://github.com/n00mkrad/cupscale/releases",
          "host": "github",
          "kind": "page",
          "where": "video_description",
          "context": "ERSONAJES EN UMKSM https://www.youtube.com/watch?v=_6ET4NV6jAI  PCSX2: https://pcsx2.net  CUPSCALE: ",
          "by_uploader": true
        },
        {
          "url": "https://www.getpaint.net/download.html",
          "host": "other",
          "kind": "unknown",
          "where": "video_description",
          "context": "6jAI  PCSX2: https://pcsx2.net  CUPSCALE: https://github.com/n00mkrad/cupscale/releases  PAINT.NET: ",
          "by_uploader": true
        },
        {
          "url": "https://reshade.me",
          "host": "other",
          "kind": "unknown",
          "where": "video_description",
          "context": "/github.com/n00mkrad/cupscale/releases  PAINT.NET: https://www.getpaint.net/download.html  RESHADE: ",
          "by_uploader": true
        },
        {
          "url": "https://www.gimp.org",
          "host": "other",
          "kind": "unknown",
          "where": "video_description",
          "context": "ale/releases  PAINT.NET: https://www.getpaint.net/download.html  RESHADE: https://reshade.me  GIMP: ",
          "by_uploader": true
        },
        {
          "url": "https://github.com/kamilburda/batcher?tab=readme-ov-file",
          "host": "github",
          "kind": "page",
          "where": "video_description",
          "context": "w.getpaint.net/download.html  RESHADE: https://reshade.me  GIMP: https://www.gimp.org  PLUGIN GIMP: ",
          "by_uploader": true
        },
        {
          "url": "https://www.youtube.com/@RelaxDirkXI",
          "host": "youtube",
          "kind": "unknown",
          "where": "video_description",
          "context": " ultimate, asi que cuando lo suba dejare un comentario fijado*  MODERS (EQUIPO DE UMKSM): RelaxDirk ",
          "by_uploader": true
        },
        {
          "url": "https://www.youtube.com/@zmodsalt001",
          "host": "youtube",
          "kind": "unknown",
          "where": "video_description",
          "context": "omentario fijado*  MODERS (EQUIPO DE UMKSM): RelaxDirk https://www.youtube.com/@RelaxDirkXI  Z Mods ",
          "by_uploader": true
        },
        {
          "url": "https://www.youtube.com/@OGmidway",
          "host": "youtube",
          "kind": "unknown",
          "where": "video_description",
          "context": "Dirk https://www.youtube.com/@RelaxDirkXI  Z Mods https://www.youtube.com/@zmodsalt001  NOTSOMIDWAY ",
          "by_uploader": true
        },
        {
          "url": "https://www.youtube.com/@TnumModder",
          "host": "youtube",
          "kind": "unknown",
          "where": "video_description",
          "context": "ds https://www.youtube.com/@zmodsalt001  NOTSOMIDWAY https://www.youtube.com/@OGmidway  TNUM_MODDER ",
          "by_uploader": true
        },
        {
          "url": "https://www.youtube.com/@NicoGC220",
          "host": "youtube",
          "kind": "unknown",
          "where": "video_description",
          "context": "OMIDWAY https://www.youtube.com/@OGmidway  TNUM_MODDER https://www.youtube.com/@TnumModder  Nico220 ",
          "by_uploader": true
        }
      ]
    }
  ],
  "candidates": [
    {
      "url": "https://www.mediafire.com/file/joq592gm0ams275/MKSM_Matasiete.rar/file",
      "host": "mediafire",
      "kind": "file",
      "where": "op",
      "context": "he characters, most of the textures were working with AI based on manual work (mainly with the models). Links Download (Mediafire) Download (Drive) *In the d"
    },
    {
      "url": "https://drive.google.com/drive/folders/182mdbJlNtOs-8JY6qNv9GqKYWVRwZb5C?usp=sharing",
      "host": "gdrive",
      "kind": "folder",
      "where": "op",
      "context": "the textures were working with AI based on manual work (mainly with the models). Links Download (Mediafire) Download (Drive) *In the drive there is a folder"
    }
  ],
  "decisions": [
    {
      "listing": "l-6a96f8be47",
      "status": "resolved",
      "base_url": "https://www.mediafire.com/file/joq592gm0ams275/MKSM_Matasiete.rar/file",
      "host": "mediafire",
      "kind": "file",
      "confidence": "high",
      "reason": "Creator posted MediaFire link in opening post.",
      "decided_by": {
        "method": "agent",
        "model": "haiku",
        "date": "2026-10-03"
      }
    }
  ]
}
