{
  "source_url": "https://gbatemp.net/threads/police-24-7-pcsx2-hd-texture.677396/",
  "listings": [
    "l-964cc97cba"
  ],
  "fetched": {
    "at": "2026-10-03",
    "status": "ok",
    "title": "Police 24-7 PCSX2 HD Texture"
  },
  "videos": [
    {
      "id": "uq9oRr8g2ug",
      "uploader": "Mvp899",
      "links": [
        {
          "url": "https://mega.nz/file/TLBGVbSB#L0cipsZ9woD2nxa8WDaj3fxiZVvBlWJh8zjUAendNgA",
          "host": "mega",
          "kind": "file",
          "where": "video_pinned_comment",
          "context": "PACK:",
          "by_uploader": true
        }
      ]
    }
  ],
  "candidates": [
    {
      "url": "https://ko-fi.com/mvp89974957",
      "host": "kofi",
      "kind": "page",
      "where": "op",
      "context": "KO-FI SERIAL: SLES-50285 CRC: 08A1C938 SIZE: 265mb"
    }
  ],
  "decisions": [
    {
      "listing": "l-964cc97cba",
      "status": "resolved",
      "base_url": "https://mega.nz/file/TLBGVbSB#L0cipsZ9woD2nxa8WDaj3fxiZVvBlWJh8zjUAendNgA",
      "host": "mega",
      "kind": "file",
      "confidence": "medium",
      "reason": "the only file-host link in video pinned comment; not yet confirmed to be the pack itself",
      "decided_by": {
        "method": "deterministic",
        "date": "2026-10-03"
      }
    }
  ]
}
